{
  "id": "srd-5.2",
  "name": "System Reference Document 5.2.1",
  "version": "1.0.0",
  "license": "CC-BY-4.0",
  "attribution": "This work includes material from the System Reference Document 5.2.1 (\"SRD 5.2.1\") by Wizards of the Coast LLC, available at https://www.dndbeyond.com/srd. The SRD 5.2.1 is licensed under the Creative Commons Attribution 4.0 International License, available at https://creativecommons.org/licenses/by/4.0/legalcode.",
  "modifications": "Changes were made. The SRD 5.2.1 material in this pack has been reformatted from prose into structured JSON, re-encoded as machine-readable effect data, and annotated with abridged summaries not present in the original.",
  "provides": [
    "classes",
    "subclasses",
    "spells",
    "species",
    "origins",
    "feats",
    "equipment",
    "conditions",
    "skills",
    "tools",
    "languages",
    "creatures",
    "rules"
  ],
  "characterCreation": {
    "languages": {
      "items": [
        "srd-5.2:language/common"
      ],
      "choose": {
        "count": 2,
        "from": [
          "srd-5.2:language/common-sign-language",
          "srd-5.2:language/draconic",
          "srd-5.2:language/dwarvish",
          "srd-5.2:language/elvish",
          "srd-5.2:language/giant",
          "srd-5.2:language/gnomish",
          "srd-5.2:language/goblin",
          "srd-5.2:language/halfling",
          "srd-5.2:language/orc"
        ]
      }
    }
  }
}
